{
  "$schema": "http://json-schema.org/draft-07/schema",
  "$id": "https://www.alpinebits.org/destinationdata/schemas/2022-04/agent",
  "description": "A resource that implements the concept of Agent defined in the AlpineBitsÂ® DestinationData Ontology.",
  "type": "object",
  "additionalProperties": false,
  "required": [ "type" ],
  "properties": {
    "id": {
      "$ref": "/destinationdata/schemas/2022-04/datatypes#/definitions/id"
    },
    "type": {
      "const": "agents"
    },
    "meta": {
      "$ref": "/destinationdata/schemas/2022-04/datatypes#/definitions/meta"
    },
    "links": {
      "$ref": "/destinationdata/schemas/2022-04/datatypes#/definitions/links"
    },
    "attributes": {
      "type": "object",
      "additionalProperties": false,
      "properties": {
        "abstract": {
          "oneOf": [
            {
              "type": "null"
            },
            {
              "$ref": "/destinationdata/schemas/2022-04/datatypes#/definitions/text"
            }
          ]
        },
        "contactPoints": {
          "type": [ "null", "array" ],
          "items": {
            "$ref": "/destinationdata/schemas/2022-04/datatypes#/definitions/contactPoint"
          },
          "minItems": 1
        },
        "description": {
          "oneOf": [
            {
              "type": "null"
            },
            {
              "$ref": "/destinationdata/schemas/2022-04/datatypes#/definitions/text"
            }
          ]
        },
        "name": {
          "$ref": "/destinationdata/schemas/2022-04/datatypes#/definitions/text"
        },
        "shortName": {
          "oneOf": [
            {
              "type": "null"
            },
            {
              "$ref": "/destinationdata/schemas/2022-04/datatypes#/definitions/text"
            }
          ]
        },
        "url": {
          "oneOf": [
            {
              "type": "null"
            },
            {
              "$ref": "/destinationdata/schemas/2022-04/datatypes#/definitions/complexUrl"
            }
          ]
        }
      }
    },
    "relationships": {
      "type": "object",
      "additionalProperties": false,
      "properties": {
        "categories": {
          "oneOf": [
            {
              "type": "null"
            },
            {
              "$ref": "/destinationdata/schemas/2022-04/datatypes#/definitions/relationshipToMany"
            }
          ]
        },
        "multimediaDescriptions": {
          "oneOf": [
            {
              "type": "null"
            },
            {
              "$ref": "/destinationdata/schemas/2022-04/datatypes#/definitions/relationshipToMany"
            }
          ]
        }
      }
    }
  }
}
