{
  "type": "agents",
  "id": "CDB3CC1EE2614488A451C467BE971571_publisher",
  "meta": {
    "dataProvider": "http://tourism.opendatahub.com/",
    "lastUpdate": "2019-11-05T00:05:58.776531+01:00"
  },
  "links": {
    "self": "http://example.com/2021-04/agents/CDB3CC1EE2614488A451C467BE971571_publisher"
  },
  "attributes": {
    "abstract": null,
    "description": null,
    "name": {
      "deu": "LTS - Landesverband der Tourismusorganisationen Südtirols",
      "eng": "LTS - Landesverband der Tourismusorganisationen Südtirols",
      "ita": "LTS - Landesverband der Tourismusorganisationen Südtirols"
    },
    "shortName": null,
    "url": "https://lts.it",
    "contactPoints": null
  },
  "relationships": {
    "categories": null,
    "multimediaDescriptions": null
  }
}